{
  "phase_id": "P1",
  "name": "Project, resource, storage and loader core",
  "status": "accepted",
  "scope": [
    "Implement documentation-root/project discovery and configuration.",
    "Discover plain Markdown and managed structured resources.",
    "Implement `$docengine` envelope parsing, schema validation and resource identity.",
    "Implement ResourceRef/FieldRef parsing and resolver.",
    "Implement immutable generic structured objects and adapters.",
    "Enforce mirrored `_structured/` convention and materialization path confinement."
  ],
  "out_of_scope": [
    "Derived builders.",
    "Baselines and dependency state."
  ],
  "deliverables": [
    "project config contract",
    "resource catalog",
    "ResourceRef/FieldRef implementation",
    "managed resource loader",
    "schema-validation adapter",
    "immutable object representation",
    "resources CLI/query payload"
  ],
  "use_cases": [
    "DOC01",
    "DOC02",
    "DOC04",
    "DOC21"
  ],
  "acceptance_axes": [
    "DAX01",
    "DAX02",
    "DAX03",
    "DAX04",
    "DAX05",
    "DAX12",
    "DAX17",
    "DAX19",
    "DAX20"
  ],
  "acceptance_criteria": [
    {
      "id": "P1-A1",
      "criterion": "Plain Markdown works without JSON sidecars and is not silently promoted to managed form.",
      "axis_ids": [
        "DAX01",
        "DAX02"
      ],
      "status": "pass",
      "evidence_refs": [
        "src/docengine/project.py",
        "src/docengine/resources.py",
        "tests/test_p1_init.py",
        "tests/test_p1_resources.py",
        "plan/evidence/P1/clean_venv_plain_resources.json"
      ],
      "notes": "P1 scope verified by positive and negative tests; global DAX closure remains deferred to P8."
    },
    {
      "id": "P1-A2",
      "criterion": "Managed JSON under documentation root validates and loads without project code manually mapping every field.",
      "axis_ids": [
        "DAX03",
        "DAX17"
      ],
      "status": "pass",
      "evidence_refs": [
        "src/docengine/config.py",
        "src/docengine/schema.py",
        "src/docengine/jsonio.py",
        "src/docengine/objects.py",
        "src/docengine/resources.py",
        "examples/sample_project/docengine_project/schemas/",
        "tests/test_schema_runtime.py",
        "tests/test_p1_resources.py"
      ],
      "notes": "P1 scope verified by positive and negative tests; global DAX closure remains deferred to P8."
    },
    {
      "id": "P1-A3",
      "criterion": "`$docengine.materialize[].path` resolves relative to documentation root and traversal outside root is rejected.",
      "axis_ids": [
        "DAX02",
        "DAX04"
      ],
      "status": "pass",
      "evidence_refs": [
        "src/docengine/resources.py",
        "src/docengine/project.py",
        "docs/STORAGE_MODEL.md",
        "tests/test_p1_resources.py",
        "tests/test_p1_init.py"
      ],
      "notes": "P1 scope verified by positive and negative tests; global DAX closure remains deferred to P8."
    },
    {
      "id": "P1-A4",
      "criterion": "ResourceRef/FieldRef round-trip parsing is stable and malformed/ambiguous refs fail clearly.",
      "axis_ids": [
        "DAX03"
      ],
      "status": "pass",
      "evidence_refs": [
        "src/docengine/refs.py",
        "tests/test_refs.py",
        "docs/RESOURCE_MODEL.md"
      ],
      "notes": "P1 scope verified by positive and negative tests; global DAX closure remains deferred to P8."
    },
    {
      "id": "P1-A5",
      "criterion": "Loaded raw objects are immutable through engine APIs.",
      "axis_ids": [
        "DAX05"
      ],
      "status": "pass",
      "evidence_refs": [
        "src/docengine/objects.py",
        "tests/test_objects.py"
      ],
      "notes": "P1 scope verified by positive and negative tests; global DAX closure remains deferred to P8."
    },
    {
      "id": "P1-A6",
      "criterion": "Sample project resource inventory is deterministic in both human and JSON output.",
      "axis_ids": [
        "DAX12",
        "DAX19"
      ],
      "status": "pass",
      "evidence_refs": [
        "src/docengine/cli.py",
        "src/docengine/resources.py",
        "plan/evidence/P1/sample_resources.json",
        "plan/evidence/P1/sample_resources.txt",
        "plan/evidence/P1/clean_venv_resources.json",
        "tests/test_p1_resources.py"
      ],
      "notes": "P1 scope verified by positive and negative tests; global DAX closure remains deferred to P8."
    }
  ],
  "pre_execution_questions": [
    {
      "id": "Q1.1",
      "question": "Как engine находит project/documentation root при запуске?",
      "why_it_matters": "Ошибочная discovery-логика может заставить AI работать не с тем деревом.",
      "blocking": true,
      "recommended_default": "Priority: explicit `--project-root`/`--docs-root` > project config > upward search from cwd; never guess across filesystem boundaries.",
      "status": "answered",
      "answer": "Priority: explicit `--project-root`/`--docs-root` > project config > upward search from cwd; never guess across filesystem boundaries.",
      "decision": "Adopt safe deterministic root discovery with strict path confinement.",
      "evidence_refs": [
        "conversation-design-decision"
      ],
      "acceptance_impact": "Must be resolved before phase acceptance.",
      "owner": "implementer"
    },
    {
      "id": "Q1.2",
      "question": "Где хранить project-level config и как его назвать?",
      "why_it_matters": "Structured data принадлежит docs, но engine registration/config нужна всему project.",
      "blocking": true,
      "recommended_default": "`docengine.toml` в project root; documentation-owned structured/runtime data остаётся under docs.",
      "status": "answered",
      "answer": "`docengine.toml` в project root; documentation-owned structured/runtime data остаётся under docs.",
      "decision": "Adopt this implementation default for v0.1 unless implementation evidence exposes a contradiction.",
      "evidence_refs": [
        "implementation-plan-default"
      ],
      "acceptance_impact": "Must be resolved before phase acceptance.",
      "owner": "implementer"
    },
    {
      "id": "Q1.3",
      "question": "Каким будет базовый runtime object representation для произвольных JSON schemas?",
      "why_it_matters": "Нужно сохранить generic loading без генерации project-specific классов вручную.",
      "blocking": true,
      "recommended_default": "Immutable generic mapping/object wrapper with field/path access; optional project adapters/dataclasses may layer on top.",
      "status": "answered",
      "answer": "Immutable generic mapping/object wrapper with field/path access; optional project adapters/dataclasses may layer on top.",
      "decision": "Adopt this implementation default for v0.1 unless implementation evidence exposes a contradiction.",
      "evidence_refs": [
        "implementation-plan-default"
      ],
      "acceptance_impact": "Must be resolved before phase acceptance.",
      "owner": "implementer"
    },
    {
      "id": "Q1.4",
      "question": "Фиксируем ли exact ResourceRef syntax уже в P1?",
      "why_it_matters": "Receipts, baselines and project code будут зависеть от стабильного адресного формата.",
      "blocking": true,
      "recommended_default": "Yes: `resource://<namespace>/<id>#/<json-pointer>` for structured resources and `file://<docs-relative-path>` for files; escaping follows URI + JSON Pointer rules.",
      "status": "answered",
      "answer": "Yes: `resource://<namespace>/<id>#/<json-pointer>` for structured resources and `file://<docs-relative-path>` for files; escaping follows URI + JSON Pointer rules.",
      "decision": "Adopt this implementation default for v0.1 unless implementation evidence exposes a contradiction.",
      "evidence_refs": [
        "implementation-plan-default"
      ],
      "acceptance_impact": "Must be resolved before phase acceptance.",
      "owner": "implementer"
    }
  ],
  "emergent_questions": [
    {
      "id": "Q1.E1",
      "owner": "implementer",
      "question": "Как разрешить обнаруженное расхождение между старыми docs-примерами `resource://policies.method_policy` и уже принятым Q1.4 форматом `resource://<namespace>/<id>`?",
      "why_it_matters": "Receipts/builders/baselines следующих фаз должны опираться на один канонический ref format.",
      "blocking": true,
      "recommended_default": "Q1.4/phase contract имеет приоритет; исправить старые docs examples и тестировать round-trip.",
      "status": "answered",
      "answer": "Использовать `resource://<namespace>/<id>#/<json-pointer>`; dotted resource_id отображается как namespace + local id.",
      "decision": "Старые dot-form URI examples исправлены; canonical parser/formatter реализован и malformed/ambiguous refs rejected.",
      "evidence_refs": [
        "src/docengine/refs.py",
        "tests/test_refs.py",
        "docs/RESOURCE_MODEL.md"
      ],
      "acceptance_impact": "Required for DAX03/P1-A4."
    },
    {
      "id": "Q1.E2",
      "owner": "implementer",
      "question": "Нужна ли обязательная runtime dependency на полный `jsonschema` validator уже в P1?",
      "why_it_matters": "Полная dependency увеличивает distribution surface, но silent partial validation также недопустима.",
      "blocking": true,
      "recommended_default": "Сохранить stdlib-first core: явный validator adapter + строгий небольшой v0.1 subset; unsupported keywords должны fail, а не игнорироваться.",
      "status": "answered",
      "answer": "Обязательную dependency не добавлять в P1; реализовать `SchemaValidator` boundary и `CoreSchemaValidator` с explicit supported subset.",
      "decision": "P1 runtime остаётся dependency-free; unknown schema URI, malformed schema и unsupported semantic keyword дают явную ошибку.",
      "evidence_refs": [
        "src/docengine/schema.py",
        "docs/RUNTIME_SCHEMA_VALIDATION.md",